ID,day_of_week_end,EG.5,States
Region 2,2023-09-30,28.03313434123993,"New Jersey, New York, Puerto Rico, and the Virgin Islands"
Region 3,2023-09-30,29.188859462738037,"Delaware, District of Columbia, Maryland, Pennsylvania, Virginia, and West Virginia"
Region 4,2023-09-30,22.20068871974945,"Alabama, Florida, Georgia, Kentucky, Mississippi, North Carolina, South Carolina, and Tennessee"
Region 5,2023-09-30,32.300809025764465,"Illinois, Indiana, Michigan, Minnesota, Ohio, and Wisconsin"
Region 6,2023-09-30,25.60834288597107,"Arkansas, Louisiana, New Mexico, Oklahoma, and Texas"
Region 7,2023-09-30,25.165271759033203,"Iowa, Kansas, Missouri, and Nebraska"
Region 8,2023-09-30,38.047248125076294,"Colorado, Montana, North Dakota, South Dakota, Utah, and Wyoming"
Region 9,2023-09-30,36.47986948490143,"Arizona, California, Hawaii, Nevada, American Samoa, Commonwealth of the Northern Mariana Islands, Federated States of Micronesia, Guam, Marshall Islands, and Republic of Palau"
