ID,day_of_week_end,HV.1,States
Region 1,2024-02-03,2.0703956484794617,"Connecticut, Maine, Massachusetts, New Hampshire, Rhode Island, and Vermont"
Region 2,2024-02-03,1.2775677256286144,"New Jersey, New York, Puerto Rico, and the Virgin Islands"
Region 3,2024-02-03,2.5973036885261536,"Delaware, District of Columbia, Maryland, Pennsylvania, Virginia, and West Virginia"
Region 4,2024-02-03,2.3791994899511337,"Alabama, Florida, Georgia, Kentucky, Mississippi, North Carolina, South Carolina, and Tennessee"
Region 5,2024-02-03,2.9388096183538437,"Illinois, Indiana, Michigan, Minnesota, Ohio, and Wisconsin"
Region 7,2024-02-03,2.6930196210741997,"Iowa, Kansas, Missouri, and Nebraska"
Region 9,2024-02-03,2.281036600470543,"Arizona, California, Hawaii, Nevada, American Samoa, Commonwealth of the Northern Mariana Islands, Federated States of Micronesia, Guam, Marshall Islands, and Republic of Palau"
