ID,day_of_week_end,HV.1,States
Region 2,2024-01-06,9.85083356499672,"New Jersey, New York, Puerto Rico, and the Virgin Islands"
Region 3,2024-01-06,16.841921210289,"Delaware, District of Columbia, Maryland, Pennsylvania, Virginia, and West Virginia"
Region 4,2024-01-06,15.72403758764267,"Alabama, Florida, Georgia, Kentucky, Mississippi, North Carolina, South Carolina, and Tennessee"
Region 5,2024-01-06,14.735041558742523,"Illinois, Indiana, Michigan, Minnesota, Ohio, and Wisconsin"
Region 7,2024-01-06,16.52655154466629,"Iowa, Kansas, Missouri, and Nebraska"
Region 9,2024-01-06,14.888475835323334,"Arizona, California, Hawaii, Nevada, American Samoa, Commonwealth of the Northern Mariana Islands, Federated States of Micronesia, Guam, Marshall Islands, and Republic of Palau"
